{
  "version": "0.1.1",
  "dialects": [
    "ANSI_SQL",
    "SNOWFLAKE"
  ],
  "vendors": [
    "MARIVO"
  ],
  "semantic_model": [
    {
      "name": "ecommerce",
      "description": "E-commerce analytics semantic model",
      "datasets": [
        {
          "name": "orders",
          "source": "analytics.ecom.orders",
          "primary_key": [
            "order_id"
          ],
          "description": "Order fact table",
          "fields": [
            {
              "name": "order_id",
              "expression": {
                "dialects": [
                  {
                    "dialect": "ANSI_SQL",
                    "expression": "order_id"
                  }
                ]
              }
            },
            {
              "name": "customer_id",
              "expression": {
                "dialects": [
                  {
                    "dialect": "ANSI_SQL",
                    "expression": "customer_id"
                  }
                ]
              }
            },
            {
              "name": "order_date",
              "expression": {
                "dialects": [
                  {
                    "dialect": "ANSI_SQL",
                    "expression": "order_date"
                  }
                ]
              },
              "dimension": {
                "is_time": true
              },
              "custom_extensions": [
                {
                  "vendor_name": "MARIVO",
                  "data": {
                    "support_min_granularity": "day",
                    "data_type": "date"
                  }
                }
              ]
            },
            {
              "name": "amount",
              "expression": {
                "dialects": [
                  {
                    "dialect": "ANSI_SQL",
                    "expression": "total_amount"
                  }
                ]
              }
            },
            {
              "name": "quantity",
              "expression": {
                "dialects": [
                  {
                    "dialect": "ANSI_SQL",
                    "expression": "item_count"
                  }
                ]
              }
            },
            {
              "name": "channel",
              "expression": {
                "dialects": [
                  {
                    "dialect": "ANSI_SQL",
                    "expression": "sales_channel"
                  }
                ]
              }
            },
            {
              "name": "is_refunded",
              "expression": {
                "dialects": [
                  {
                    "dialect": "ANSI_SQL",
                    "expression": "refund_flag"
                  }
                ]
              }
            }
          ],
          "custom_extensions": [
            {
              "vendor_name": "MARIVO",
              "data": {
                "datasource_id": "ds_snowflake_prod"
              }
            }
          ]
        },
        {
          "name": "customers",
          "source": "analytics.ecom.customers",
          "primary_key": [
            "customer_id"
          ],
          "description": "Customer dimension table",
          "fields": [
            {
              "name": "customer_id",
              "expression": {
                "dialects": [
                  {
                    "dialect": "ANSI_SQL",
                    "expression": "customer_id"
                  }
                ]
              }
            },
            {
              "name": "name",
              "expression": {
                "dialects": [
                  {
                    "dialect": "ANSI_SQL",
                    "expression": "full_name"
                  }
                ]
              }
            },
            {
              "name": "signup_date",
              "expression": {
                "dialects": [
                  {
                    "dialect": "ANSI_SQL",
                    "expression": "created_at"
                  }
                ]
              },
              "dimension": {
                "is_time": true
              },
              "custom_extensions": [
                {
                  "vendor_name": "MARIVO",
                  "data": {
                    "support_min_granularity": "day",
                    "data_type": "date"
                  }
                }
              ]
            },
            {
              "name": "region",
              "expression": {
                "dialects": [
                  {
                    "dialect": "ANSI_SQL",
                    "expression": "geo_region"
                  }
                ]
              }
            }
          ],
          "custom_extensions": [
            {
              "vendor_name": "MARIVO",
              "data": {
                "datasource_id": "ds_snowflake_prod"
              }
            }
          ]
        },
        {
          "name": "products",
          "source": "analytics.ecom.products",
          "primary_key": [
            "product_id"
          ],
          "description": "Product dimension table",
          "fields": [
            {
              "name": "product_id",
              "expression": {
                "dialects": [
                  {
                    "dialect": "ANSI_SQL",
                    "expression": "product_id"
                  }
                ]
              }
            },
            {
              "name": "category",
              "expression": {
                "dialects": [
                  {
                    "dialect": "ANSI_SQL",
                    "expression": "product_category"
                  }
                ]
              }
            },
            {
              "name": "price",
              "expression": {
                "dialects": [
                  {
                    "dialect": "ANSI_SQL",
                    "expression": "unit_price"
                  }
                ]
              }
            }
          ],
          "custom_extensions": [
            {
              "vendor_name": "MARIVO",
              "data": {
                "datasource_id": "ds_snowflake_prod"
              }
            }
          ]
        }
      ],
      "relationships": [
        {
          "name": "orders_to_customers",
          "from": "orders",
          "to": "customers",
          "from_columns": [
            "customer_id"
          ],
          "to_columns": [
            "customer_id"
          ]
        }
      ],
      "metrics": [
        {
          "name": "gmv",
          "expression": {
            "dialects": [
              {
                "dialect": "ANSI_SQL",
                "expression": "SUM(total_amount)"
              }
            ]
          },
          "description": "Gross merchandise value",
          "custom_extensions": [
            {
              "vendor_name": "MARIVO",
              "data": {
                "decomposition_semantics": { "type": "sum" }
              }
            }
          ]
        },
        {
          "name": "order_count",
          "expression": {
            "dialects": [
              {
                "dialect": "ANSI_SQL",
                "expression": "COUNT(DISTINCT order_id)"
              }
            ]
          },
          "description": "Number of unique orders",
          "custom_extensions": [
            {
              "vendor_name": "MARIVO",
              "data": {
                "decomposition_semantics": { "type": "sum" }
              }
            }
          ]
        },
        {
          "name": "aov",
          "expression": {
            "dialects": [
              {
                "dialect": "ANSI_SQL",
                "expression": "SUM(total_amount) / COUNT(DISTINCT order_id)"
              }
            ]
          },
          "description": "Average order value",
          "custom_extensions": [
            {
              "vendor_name": "MARIVO",
              "data": {
                "decomposition_semantics": {
                  "type": "weighted_average",
                  "numerator": { "metric": "metric.gmv" },
                  "weight": { "metric": "metric.order_count" }
                }
              }
            }
          ]
        }
      ],
      "custom_extensions": []
    }
  ]
}
